{
  "$schema": "https://json-schema.org/draft/2020-12/schema",
  "$id": "https://schemas.yet-ai.example/contracts/engine/agent-progress-event.schema.json",
  "title": "Agent Progress Event",
  "description": "Local planner/agent progress event with bounded sanitized operational status only. It excludes raw prompts, chain-of-thought, provider responses, secrets, private paths, credential paths, and workspace file contents.",
  "type": "object",
  "additionalProperties": false,
  "required": [
    "protocolVersion",
    "eventId",
    "runId",
    "cardId",
    "timestamp",
    "phase",
    "status",
    "message"
  ],
  "properties": {
    "protocolVersion": {
      "type": "string",
      "const": "2026-05-29"
    },
    "eventId": {
      "$ref": "#/$defs/id"
    },
    "runId": {
      "$ref": "#/$defs/id"
    },
    "cardId": {
      "$ref": "#/$defs/cardId"
    },
    "timestamp": {
      "$ref": "#/$defs/timestamp"
    },
    "phase": {
      "$ref": "#/$defs/phase"
    },
    "status": {
      "$ref": "#/$defs/status"
    },
    "message": {
      "$ref": "#/$defs/safeMessage"
    },
    "tool": {
      "$ref": "#/$defs/toolSummary"
    },
    "heartbeat": {
      "$ref": "#/$defs/heartbeat"
    },
    "outputTail": {
      "$ref": "#/$defs/outputTail"
    },
    "ideAction": {
      "$ref": "#/$defs/ideAction"
    }
  },
  "$defs": {
    "id": {
      "type": "string",
      "minLength": 1,
      "maxLength": 128,
      "pattern": "^(?!.*(?:[Aa][Uu][Tt][Hh][Oo][Rr][Ii][Zz][Aa][Tt][Ii][Oo][Nn]|[Bb][Ee][Aa][Rr][Ee][Rr]|[Aa][Pp][Ii][-_]?[Kk][Ee][Yy]|[Tt][Oo][Kk][Ee][Nn]|[Ss][Ee][Cc][Rr][Ee][Tt]|[Aa][Cc][Cc][Ee][Ss][Ss][-_]?[Tt][Oo][Kk][Ee][Nn]|sk-(?:proj-)?[A-Za-z0-9_-]{8,}))[A-Za-z0-9][A-Za-z0-9_.-]{0,127}$"
    },
    "requestId": {
      "type": "string",
      "minLength": 1,
      "maxLength": 128,
      "pattern": "^(?!.*(?:[Aa][Uu][Tt][Hh][Oo][Rr][Ii][Zz][Aa][Tt][Ii][Oo][Nn]|[Bb][Ee][Aa][Rr][Ee][Rr]|[Aa][Pp][Ii][-_]?[Kk][Ee][Yy]|[Tt][Oo][Kk][Ee][Nn]|[Ss][Ee][Cc][Rr][Ee][Tt]|[Aa][Cc][Cc][Ee][Ss][Ss][-_]?[Tt][Oo][Kk][Ee][Nn]|sk-(?:proj-)?[A-Za-z0-9_-]{8,}))[A-Za-z0-9][A-Za-z0-9_.-]{0,127}$"
    },
    "cardId": {
      "type": "string",
      "minLength": 1,
      "maxLength": 64,
      "pattern": "^(?!.*(?:[Aa][Uu][Tt][Hh][Oo][Rr][Ii][Zz][Aa][Tt][Ii][Oo][Nn]|[Bb][Ee][Aa][Rr][Ee][Rr]|[Aa][Pp][Ii][-_]?[Kk][Ee][Yy]|[Tt][Oo][Kk][Ee][Nn]|[Ss][Ee][Cc][Rr][Ee][Tt]|[Aa][Cc][Cc][Ee][Ss][Ss][-_]?[Tt][Oo][Kk][Ee][Nn]|sk-(?:proj-)?[A-Za-z0-9_-]{8,}))[A-Za-z0-9][A-Za-z0-9_-]{0,63}$"
    },
    "timestamp": {
      "type": "string",
      "format": "date-time",
      "minLength": 20,
      "maxLength": 32,
      "pattern": "Z$"
    },
    "phase": {
      "type": "string",
      "enum": [
        "queued",
        "started",
        "reading_context",
        "editing",
        "running_command",
        "waiting_for_tool",
        "verifying",
        "finishing",
        "done",
        "failed",
        "stuck"
      ]
    },
    "status": {
      "type": "string",
      "enum": [
        "pending",
        "running",
        "healthy_running",
        "long_running",
        "stalled",
        "stuck",
        "done",
        "failed"
      ]
    },
    "safeText": {
      "type": "string",
      "pattern": "^(?![\\s\\S]*(?:[aA][pP][iI][-_ ]?[kK][eE][yY]|[aA][uU][tT][hH][oO][rR][iI][zZ][aA][tT][iI][oO][nN]|[bB][eE][aA][rR][eE][rR]|[tT][oO][kK][eE][nN]|[sS][eE][cC][rR][eE][tT]|[pP][aA][sS][sS][wW][oO][rR][dD]|[cC][oO][oO][kK][iI][eE]|[pP][kK][cC][eE]|[rR][eE][fF][rR][eE][sS][hH]|[aA][cC][cC][eE][sS][sS][-_ ]?[tT][oO][kK][eE][nN]|[aA][uU][tT][hH][-_ ]?[cC][oO][dD][eE]|[cC][hH][aA][iI][nN][-_ ]?[oO][fF][-_ ]?[tT][hH][oO][uU][gG][hH][tT]|[rR][aA][wW][-_ ]?(?:[pP][rR][oO][mM][pP][tT]|[dD][uU][mM][pP]|[oO][uU][tT][pP][uU][tT]|[fF][iI][lL][eE]|[wW][oO][rR][kK][sS][pP][aA][cC][eE])|[pP][rR][oO][vV][iI][dD][eE][rR][-_ ]?(?:[rR][eE][sS][pP][oO][nN][sS][eE]|[bB][oO][dD][yY])|[cC][rR][eE][dD][eE][nN][tT][iI][aA][lL]|[fF][iI][lL][eE][-_ ]?[cC][oO][nN][tT][eE][nN][tT]|[wW][oO][rR][kK][sS][pP][aA][cC][eE][-_ ]?(?:[fF][iI][lL][eE]|[cC][oO][nN][tT][eE][nN][tT])|(?:^|[^A-Za-z0-9_-])sk-(?:proj-)?[A-Za-z0-9_-]{8,}|/[Uu][Ss][Ee][Rr][Ss](?:/|$)|/[Hh][Oo][Mm][Ee](?:/|$)|/[Tt][Mm][Pp](?:/|$)|/[Ee][Tt][Cc](?:/|$)|/[Oo][Pp][Tt](?:/|$)|/[Mm][Nn][Tt](?:/|$)|/[Vv][Aa][Rr](?:/|$)|/[Vv][Oo][Ll][Uu][Mm][Ee][Ss](?:/|$)|/[Pp][Rr][Ii][Vv][Aa][Tt][Ee](?:/|$)|[A-Za-z]:(?:/|\\\\)|~/|\\.[cC][oO][dD][eE][xX]/[aA][uU][tT][hH]\\.json|(?:[aA][uU][tT][hH]|[cC][rR][eE][dD][eE][nN][tT][iI][aA][lL][sS]?)\\.json|BEGIN [A-Z ]*PRIVATE KEY))[\\s\\S]*$"
    },
    "safeMessage": {
      "allOf": [
        {
          "$ref": "#/$defs/safeText"
        },
        {
          "type": "string",
          "minLength": 1,
          "maxLength": 280
        }
      ]
    },
    "outputTail": {
      "allOf": [
        {
          "$ref": "#/$defs/safeText"
        },
        {
          "type": "string",
          "maxLength": 2000
        }
      ]
    },
    "toolKind": {
      "type": "string",
      "enum": [
        "read",
        "edit",
        "command",
        "test",
        "validation",
        "network",
        "planner",
        "other"
      ]
    },
    "toolSummary": {
      "type": "object",
      "additionalProperties": false,
      "required": [
        "kind",
        "label"
      ],
      "properties": {
        "kind": {
          "$ref": "#/$defs/toolKind"
        },
        "label": {
          "allOf": [
            {
              "$ref": "#/$defs/safeText"
            },
            {
              "type": "string",
              "minLength": 1,
              "maxLength": 160
            }
          ]
        },
        "startedAt": {
          "$ref": "#/$defs/timestamp"
        },
        "elapsedMs": {
          "type": "integer",
          "minimum": 0,
          "maximum": 86400000
        }
      }
    },
    "heartbeat": {
      "type": "object",
      "additionalProperties": false,
      "required": [
        "lastHeartbeatAt"
      ],
      "properties": {
        "lastHeartbeatAt": {
          "$ref": "#/$defs/timestamp"
        },
        "lastToolOutputAt": {
          "$ref": "#/$defs/timestamp"
        },
        "attempt": {
          "type": "integer",
          "minimum": 1,
          "maximum": 100
        }
      }
    },
    "safeRelativePath": {
      "type": "string",
      "minLength": 1,
      "maxLength": 512,
      "pattern": "^(?!/)(?!~)(?!.*%)(?!.*\\\\)(?!.*:)(?!.*[?#])(?!.*(?:^|/)\\.\\.?(?:/|$))(?!.*//)(?!.*\\/$)(?!.*(?:^|/)(?:[Aa][Uu][Tt][Hh]|[Aa][Uu][Tt][Hh][Oo][Rr][Ii][Zz][Aa][Tt][Ii][Oo][Nn]|[Bb][Ee][Aa][Rr][Ee][Rr]|[Cc][Oo][Oo][Kk][Ii][Ee]|[Cc][Rr][Ee][Dd][Ee][Nn][Tt][Ii][Aa][Ll][Ss]?|[Pp][Aa][Ss][Ss][Ww][Oo][Rr][Dd]|[Ss][Ee][Cc][Rr][Ee][Tt]|[Tt][Oo][Kk][Ee][Nn]|[Aa][Cc][Cc][Ee][Ss][Ss][_-]?[Tt][Oo][Kk][Ee][Nn]|[Aa][Pp][Ii][_-]?[Kk][Ee][Yy])(?:[._-]|/|$))(?!.*(?:^|[._-])(?:[Aa][Uu][Tt][Hh]|[Cc][Rr][Ee][Dd][Ee][Nn][Tt][Ii][Aa][Ll][Ss]?|[Pp][Aa][Ss][Ss][Ww][Oo][Rr][Dd]|[Ss][Ee][Cc][Rr][Ee][Tt]|[Tt][Oo][Kk][Ee][Nn]|[Aa][Cc][Cc][Ee][Ss][Ss][_-]?[Tt][Oo][Kk][Ee][Nn]|[Aa][Pp][Ii][_-]?[Kk][Ee][Yy])(?:[._-]|$))(?!.*(?:^|/)sk-(?:proj-)?[A-Za-z0-9_-]{8,})[^\\u0000-\\u001f\\u007f-\\u009f]+$"
    },
    "position": {
      "type": "object",
      "additionalProperties": false,
      "required": [
        "line",
        "character"
      ],
      "properties": {
        "line": {
          "type": "integer",
          "minimum": 0,
          "maximum": 1000000
        },
        "character": {
          "type": "integer",
          "minimum": 0,
          "maximum": 1000000
        }
      }
    },
    "range": {
      "type": "object",
      "additionalProperties": false,
      "required": [
        "start",
        "end"
      ],
      "properties": {
        "start": {
          "$ref": "#/$defs/position"
        },
        "end": {
          "$ref": "#/$defs/position"
        }
      },
      "allOf": [
        {
          "properties": {
            "end": {
              "type": "object",
              "properties": {
                "line": {
                  "type": "integer",
                  "minimum": {
                    "$data": "2/start/line"
                  }
                }
              }
            }
          }
        },
        {
          "if": {
            "properties": {
              "start": {
                "type": "object",
                "properties": {
                  "line": true
                },
                "required": [
                  "line"
                ]
              },
              "end": {
                "type": "object",
                "properties": {
                  "line": {
                    "type": "integer",
                    "const": {
                      "$data": "2/start/line"
                    }
                  }
                },
                "required": [
                  "line"
                ]
              }
            },
            "required": [
              "start",
              "end"
            ]
          },
          "then": {
            "properties": {
              "end": {
                "type": "object",
                "properties": {
                  "character": {
                    "type": "integer",
                    "minimum": {
                      "$data": "2/start/character"
                    }
                  }
                }
              }
            }
          }
        }
      ]
    },
    "ideAction": {
      "oneOf": [
        {
          "type": "object",
          "additionalProperties": false,
          "required": [
            "requestId",
            "action"
          ],
          "properties": {
            "requestId": {
              "$ref": "#/$defs/requestId"
            },
            "action": {
              "const": "getContextSnapshot"
            },
            "source": {
              "$ref": "#/$defs/ideActionSource"
            }
          }
        },
        {
          "type": "object",
          "additionalProperties": false,
          "required": [
            "requestId",
            "action",
            "workspaceRelativePath"
          ],
          "properties": {
            "requestId": {
              "$ref": "#/$defs/requestId"
            },
            "action": {
              "const": "openWorkspaceFile"
            },
            "workspaceRelativePath": {
              "$ref": "#/$defs/safeRelativePath"
            },
            "source": {
              "$ref": "#/$defs/ideActionSource"
            }
          }
        },
        {
          "type": "object",
          "additionalProperties": false,
          "required": [
            "requestId",
            "action",
            "workspaceRelativePath",
            "range"
          ],
          "properties": {
            "requestId": {
              "$ref": "#/$defs/requestId"
            },
            "action": {
              "const": "revealWorkspaceRange"
            },
            "workspaceRelativePath": {
              "$ref": "#/$defs/safeRelativePath"
            },
            "range": {
              "$ref": "#/$defs/range"
            },
            "source": {
              "$ref": "#/$defs/ideActionSource"
            }
          }
        }
      ]
    },
    "ideActionSource": {
      "type": "string",
      "enum": [
        "vscode",
        "engine"
      ]
    }
  }
}
