{
  "protocolVersion": "2026-05-29",
  "eventId": "evt-T269-ide-action-001",
  "runId": "run-T269-ide-action",
  "cardId": "T269",
  "timestamp": "2026-05-29T15:10:00Z",
  "phase": "waiting_for_tool",
  "status": "healthy_running",
  "message": "IDE action progress received with sanitized metadata.",
  "tool": {
    "kind": "other",
    "label": "IDE action reveal workspace range",
    "startedAt": "2026-05-29T15:09:58Z",
    "elapsedMs": 2000
  },
  "heartbeat": {
    "lastHeartbeatAt": "2026-05-29T15:10:00Z",
    "attempt": 1
  },
  "outputTail": "IDE host reported bounded progress for request ide-action-42."
}
